{
  "$schema": "../../packages/mdcp-core/mdcp.config.schema.json",
  "outputFile": "guides.md",
  "compileOrder": ["overview", "admin-guide", "developer-guide"],
  "banner": "<!-- AUTO-GENERATED by mdcp \u2014 edit shards, then run: mdcp compile -->\n\n",
  "guides": [
    {
      "name": "overview",
      "compile": {
        "links": {
          "markBroken": false
        }
      }
    },
    {
      "name": "admin-guide",
      "compile": {
        "links": {
          "markBroken": false
        }
      }
    },
    {
      "name": "developer-guide",
      "compile": {
        "links": {
          "markBroken": false
        }
      }
    },
    {
      "name": "inserts-demo",
      "compile": {
        "hooks": ["inlineInserts"],
        "links": {
          "markBroken": false
        }
      }
    }
  ],
  "refs": {
    "slugAlgorithm": "github"
  },
  "lint": {
    "markdownlint": {
      "shardsConfig": "../../packages/mdcp-presets/markdownlint-shards.markdownlint-cli2.jsonc",
      "compiledConfig": "../../packages/mdcp-presets/markdownlint-compiled.markdownlint-cli2.jsonc"
    },
    "xrefs": {
      "enabled": true
    },
    "links": {
      "enabled": false
    }
  },
  "vale": {
    "config": ".vale.ini",
    "scanGlobs": ["overview", "admin-guide", "developer-guide"]
  },
  "export": {
    "llm": {
      "stripHtmlComments": true,
      "stripFrontmatter": true,
      "stripBanner": true,
      "collapseBlankLines": true
    }
  }
}
